[
  {
    "id": "smart-mx-v5-55",
    "brand": "SMART",
    "model": "SMART Board MX (V5) 55\u201d Interactive Display with iQ",
    "size": 55,
    "resolution": "3840x2160",
    "os": "Android 13 (Upgradeable to 15) + Windows (via OPS)",
    "touchTechnology": "HyPr Touch (InGlass)",
    "features": [
      "HyPr Touch with Advanced IR",
      "Object Awareness and Simultaneous Tool Differentiation",
      "Integrated iQ Android 13 OS with OTA updates",
      "Built-in speakers and microphone array",
      "Proximity, ambient light, and IR sensors",
      "Supports NFC sign-in and device-based SMART Account login",
      "Split screen and Picture-in-Picture with touch passthrough",
      "Supports SMART Notebook, Lumio, and SMART Ink",
      "Wi-Fi 6E and Bluetooth 5.2",
      "Google Play Store and cloud storage access"
    ],
    "warranty": "3 years",
    "priceRange": "$2,200 - $3,200",
    "image": "https://www.smarttech.com/-/media/images/products/interactive-displays/mx/mx-v5/mx-v5-55.png",
    "brightness": "300 cd/m\u00b2",
    "contrastRatio": "Not specified",
    "viewingAngle": "178\u00b0",
    "responseTime": "8 ms",
    "panelLife": "50000 hours",
    "audioOutput": "15W x2",
    "powerConsumption": "72W"
  },
  {
    "id": "smart-mx-v5-65",
    "brand": "SMART",
    "model": "SMART Board MX (V5) 65\u201d Interactive Display with iQ",
    "size": 65,
    "resolution": "3840x2160",
    "os": "Android 13 (Upgradeable to 15) + Windows (via OPS)",
    "touchTechnology": "HyPr Touch (InGlass)",
    "features": [
      "HyPr Touch with Advanced IR",
      "Object Awareness and Simultaneous Tool Differentiation",
      "Integrated iQ Android 13 OS with OTA updates",
      "Built-in speakers and microphone array",
      "Proximity, ambient light, and IR sensors",
      "Supports NFC sign-in and device-based SMART Account login",
      "Split screen and Picture-in-Picture with touch passthrough",
      "Supports SMART Notebook, Lumio, and SMART Ink",
      "Wi-Fi 6E and Bluetooth 5.2",
      "Google Play Store and cloud storage access"
    ],
    "warranty": "3 years",
    "priceRange": "$2,500 - $3,500",
    "image": "https://www.smarttech.com/-/media/images/products/interactive-displays/mx/mx-v5/mx-v5-65.png",
    "brightness": "400 cd/m\u00b2",
    "contrastRatio": "Not specified",
    "viewingAngle": "178\u00b0",
    "responseTime": "8 ms",
    "panelLife": "50000 hours",
    "audioOutput": "20W x2",
    "powerConsumption": "90W"
  },
  {
    "id": "smart-mx-v5-75",
    "brand": "SMART",
    "model": "SMART Board MX (V5) 75\u201d Interactive Display with iQ",
    "size": 75,
    "resolution": "3840x2160",
    "os": "Android 13 (Upgradeable to 15) + Windows (via OPS)",
    "touchTechnology": "HyPr Touch (InGlass)",
    "features": [
      "HyPr Touch with Advanced IR",
      "Object Awareness and Simultaneous Tool Differentiation",
      "Integrated iQ Android 13 OS with OTA updates",
      "Built-in speakers and microphone array",
      "Proximity, ambient light, and IR sensors",
      "Supports NFC sign-in and device-based SMART Account login",
      "Split screen and Picture-in-Picture with touch passthrough",
      "Supports SMART Notebook, Lumio, and SMART Ink",
      "Wi-Fi 6E and Bluetooth 5.2",
      "Google Play Store and cloud storage access"
    ],
    "warranty": "3 years",
    "priceRange": "$3,000 - $4,200",
    "image": "https://www.smarttech.com/-/media/images/products/interactive-displays/mx/mx-v5/mx-v5-75.png",
    "brightness": "400 cd/m\u00b2",
    "contrastRatio": "Not specified",
    "viewingAngle": "178\u00b0",
    "responseTime": "8 ms",
    "panelLife": "50000 hours",
    "audioOutput": "20W x2",
    "powerConsumption": "103W"
  },
  {
    "id": "smart-mx-v5-86",
    "brand": "SMART",
    "model": "SMART Board MX (V5) 86\u201d Interactive Display with iQ",
    "size": 86,
    "resolution": "3840x2160",
    "os": "Android 13 (Upgradeable to 15) + Windows (via OPS)",
    "touchTechnology": "HyPr Touch (InGlass)",
    "features": [
      "HyPr Touch with Advanced IR",
      "Object Awareness and Simultaneous Tool Differentiation",
      "Integrated iQ Android 13 OS with OTA updates",
      "Built-in speakers and microphone array",
      "Proximity, ambient light, and IR sensors",
      "Supports NFC sign-in and device-based SMART Account login",
      "Split screen and Picture-in-Picture with touch passthrough",
      "Supports SMART Notebook, Lumio, and SMART Ink",
      "Wi-Fi 6E and Bluetooth 5.2",
      "Google Play Store and cloud storage access"
    ],
    "warranty": "3 years",
    "priceRange": "$3,500 - $4,800",
    "image": "https://www.smarttech.com/-/media/images/products/interactive-displays/mx/mx-v5/mx-v5-86.png",
    "brightness": "400 cd/m\u00b2",
    "contrastRatio": "Not specified",
    "viewingAngle": "178\u00b0",
    "responseTime": "8 ms",
    "panelLife": "50000 hours",
    "audioOutput": "20W x2",
    "powerConsumption": "149W"
  }
]