[
  {
    "id": "smart-6000s-v3-65",
    "brand": "SMART",
    "model": "SMART Board 6000S (V3) 65\u201d Interactive Display with iQ",
    "size": 65,
    "resolution": "3840x2160",
    "os": "Android 11 + Windows (via OPS)",
    "touchTechnology": "HyPr Touch (InGlass)",
    "features": [
      "HyPr Touch with InGlass and Tool Explorer support",
      "Object Awareness, Simultaneous Tool Differentiation, and Pressure Sensitive Ink",
      "iQ built-in Android 11 experience with OTA updates",
      "SMART Notebook, SMART Ink, and Remote Management included",
      "Four-microphone array with 2 \u00d7 20W speakers",
      "NFC sign-in with SMART Account integration",
      "Live input preview, templates, and manipulatives",
      "Supports third-party apps and cloud storage access",
      "Wi-Fi a/b/g/n/ac, Bluetooth 5.0, and dual-band antenna"
    ],
    "warranty": "3 years",
    "priceRange": "$2,800 - $3,600",
    "image": "/assets/models/SMARTBoard-6000S-V3.png",
    "brightness": "350 cd/m\u00b2",
    "contrastRatio": "Not specified",
    "viewingAngle": "178\u00b0",
    "responseTime": "9 ms",
    "panelLife": "50000 hours",
    "audioOutput": "20W x2",
    "powerConsumption": "105W"
  },
  {
    "id": "smart-6000s-v3-75",
    "brand": "SMART",
    "model": "SMART Board 6000S (V3) 75\u201d Interactive Display with iQ",
    "size": 75,
    "resolution": "3840x2160",
    "os": "Android 11 + Windows (via OPS)",
    "touchTechnology": "HyPr Touch (InGlass)",
    "features": [
      "HyPr Touch with InGlass and Tool Explorer support",
      "Object Awareness, Simultaneous Tool Differentiation, and Pressure Sensitive Ink",
      "iQ built-in Android 11 experience with OTA updates",
      "SMART Notebook, SMART Ink, and Remote Management included",
      "Four-microphone array with 2 \u00d7 20W speakers",
      "NFC sign-in with SMART Account integration",
      "Live input preview, templates, and manipulatives",
      "Supports third-party apps and cloud storage access",
      "Wi-Fi a/b/g/n/ac, Bluetooth 5.0, and dual-band antenna"
    ],
    "warranty": "3 years",
    "priceRange": "$3,200 - $4,200",
    "image": "/assets/models/SMARTBoard-6000S-V3.png",
    "brightness": "350 cd/m\u00b2",
    "contrastRatio": "Not specified",
    "viewingAngle": "178\u00b0",
    "responseTime": "8 ms",
    "panelLife": "50000 hours",
    "audioOutput": "20W x2",
    "powerConsumption": "134W"
  },
  {
    "id": "smart-6000s-v3-86",
    "brand": "SMART",
    "model": "SMART Board 6000S (V3) 86\u201d Interactive Display with iQ",
    "size": 86,
    "resolution": "3840x2160",
    "os": "Android 11 + Windows (via OPS)",
    "touchTechnology": "HyPr Touch (InGlass)",
    "features": [
      "HyPr Touch with InGlass and Tool Explorer support",
      "Object Awareness, Simultaneous Tool Differentiation, and Pressure Sensitive Ink",
      "iQ built-in Android 11 experience with OTA updates",
      "SMART Notebook, SMART Ink, and Remote Management included",
      "Four-microphone array with 2 \u00d7 20W speakers",
      "NFC sign-in with SMART Account integration",
      "Live input preview, templates, and manipulatives",
      "Supports third-party apps and cloud storage access",
      "Wi-Fi a/b/g/n/ac, Bluetooth 5.0, and dual-band antenna"
    ],
    "warranty": "3 years",
    "priceRange": "$3,800 - $4,800",
    "image": "/assets/models/SMARTBoard-6000S-V3.png",
    "brightness": "350 cd/m\u00b2",
    "contrastRatio": "Not specified",
    "viewingAngle": "178\u00b0",
    "responseTime": "8 ms",
    "panelLife": "50000 hours",
    "audioOutput": "20W x2",
    "powerConsumption": "161W"
  }
]